{
  "$schema": "https://json-schema.org/draft/2020-12/schema",
  "$id": "https://schemas.ukma.dev/v1/traceability.analyze_change_impact.request.schema.json",
  "title": "traceability.analyze_change_impact Request [PHASE2 PROVISIONAL]",
  "type": "object",
  "additionalProperties": false,
  "required": [
    "api_version",
    "operation",
    "context",
    "input"
  ],
  "properties": {
    "api_version": {
      "const": "1"
    },
    "operation": {
      "const": "ukma.traceability.analyze_change_impact.v1"
    },
    "context": {
      "$ref": "shared.schema.json#/$defs/RequestContext"
    },
    "input": {
      "type": "object",
      "properties": {
        "query": {
          "$comment": "UNRESOLVED TYPE: TraceImpactQuery"
        }
      },
      "required": [
        "query"
      ],
      "additionalProperties": false
    }
  },
  "$comment": "NOT A CLOSED INPUT CONTRACT: inferred from normative markdown table; require exact IDL and invariants."
}
